{"schema":"pipeline.publication-capability-preflight.v1","preflightId":"nova-a56-preflight-exercise-20260818","candidate":{"commit":"730282fc0633044b1e7d88cbb6f9f3cad778e456","tree":"7a4c30e7f08d667d8191d29378de5d389b7216e5"},"remote":{"name":"origin","fingerprint":"6d701b432e5583af95ddcfc3363500a9f53dddd0b2c199834f0b0cd8b8e5904c","status":"available","evidenceSha256":"42defdbc6382b4c1cfe2de92002fed58567198a87d67d84025679eadde55d324"},"destinationRef":"refs/heads/main","remotePreimage":"dd1eb9eedeb7ac48860c8ec9745750c9a8367b32","credential":{"status":"available","evidenceSha256":"22d05524185c4ee912054188831279d860f9256bcfbbb150bb6c1803d835c613"},"permissions":{"status":"available","evidenceSha256":"230d89cdccd57b98f8c17fa6c5e14d98c654dbff373c521c1fcb02b52cc16e16"},"workflowUpdate":{"status":"not-required","evidenceSha256":"f5215114bc8c72a1337456823d21b41c455574e32b3f65e9d1029f2f34d7b678"},"policy":{"status":"available","evidenceSha256":"b6e1dd90e938517bacbc6e4a9263eda79e9aa30c735421461e1d9e017bfba6bf"},"executor":{"status":"available","evidenceSha256":"8f05553f4bb774aaa1a2d1df2663b04151d92cc1acecaec454a5557e3ef5978b"},"status":"ready","reasons":[],"recordSha256":"9b411b80061bc32b24c0689f5e2456b7d32cbffb61711436bb6602852d7472e6"}
